{
  "$schema": "https://json-schema.org/draft/2020-12/schema",
  "$id": "urn:locus:schema:managed-performance-evidence-profile-v1",
  "type": "object",
  "additionalProperties": false,
  "required": ["collection_authorized", "decision_id", "derived_ids", "format_id", "instrumentation_id", "measured_slot_count", "methodology_id", "processor_id", "publication", "result_ids", "retained_root", "scenario_manifest_id", "scheduled_slot_count", "status"],
  "properties": {
    "collection_authorized": {"const": false},
    "decision_id": {"const": "D029"},
    "derived_ids": {"const": ["LOCUS-managed-performance-summary-v1", "LOCUS-managed-performance-comparison-v1", "LOCUS-managed-performance-corpus-manifest-v1"]},
    "format_id": {"const": "LOCUS-managed-performance-evidence-profile-v1"},
    "instrumentation_id": {"const": "LOCUS-managed-performance-instrumentation-v1"},
    "measured_slot_count": {"const": 1180},
    "methodology_id": {"const": "LOCUS-managed-performance-methodology-v1"},
    "processor_id": {"const": "LOCUS-managed-performance-processor-v1"},
    "publication": {"const": "append-only-unsealed-until-closing-manifest"},
    "result_ids": {"const": ["LOCUS-managed-performance-result-yi-v1", "LOCUS-managed-performance-result-appss-v1", "LOCUS-managed-performance-result-common-v1"]},
    "retained_root": {"const": "evidence/retained/managed-performance-v1"},
    "scenario_manifest_id": {"const": "LOCUS-managed-performance-scenario-manifest-v1"},
    "scheduled_slot_count": {"const": 1220},
    "status": {"const": "assigned-non-collecting"}
  }
}
