{"collection_authorized":false,"decision_id":"D029","derived_ids":["LOCUS-managed-performance-summary-v1","LOCUS-managed-performance-comparison-v1","LOCUS-managed-performance-corpus-manifest-v1"],"format_id":"LOCUS-managed-performance-evidence-profile-v1","instrumentation_id":"LOCUS-managed-performance-instrumentation-v1","measured_slot_count":1180,"methodology_id":"LOCUS-managed-performance-methodology-v1","processor_id":"LOCUS-managed-performance-processor-v1","publication":"append-only-unsealed-until-closing-manifest","result_ids":["LOCUS-managed-performance-result-yi-v1","LOCUS-managed-performance-result-appss-v1","LOCUS-managed-performance-result-common-v1"],"retained_root":"evidence/retained/managed-performance-v1","scenario_manifest_id":"LOCUS-managed-performance-scenario-manifest-v1","scheduled_slot_count":1220,"status":"assigned-non-collecting"}
